{
  "attemptPolicy": {
    "attemptPath": "real-llm-beacon-results/attempt.json",
    "beaconFetchedAfterMarker": true,
    "crashConsumesSuite": true,
    "createdBeforeBeaconAndDataResolution": true,
    "exclusiveDurableCreation": true,
    "firstPublicAttemptIsNormative": true,
    "rerunAfterMarker": false
  },
  "author": {
    "github": "https://github.com/ALLPROTO",
    "name": "Ivan Tyshchenko",
    "orcid": "https://orcid.org/0009-0000-7935-6090"
  },
  "beacon": {
    "certificateEndpointPrefix": "https://beacon.nist.gov/beacon/2.0/certificate/",
    "exactPulseRequired": true,
    "expectedCertificateId": "528943a555f5f8ca54423be6dfb95925a35c7b552046420e7d7cd072058a14d6536ad3a8e9754b6582f164a90b0cd86a65d659f5426a2659a947595d1c816c8c",
    "fallback": "forbidden",
    "periodMilliseconds": 60000,
    "pulseEndpoint": "https://beacon.nist.gov/beacon/2.0/pulse/time/1785693600000",
    "service": "NIST Randomness Beacon",
    "targetTimestamp": "2026-08-02T18:00:00.000Z",
    "targetUnixMilliseconds": 1785693600000,
    "verification": [
      "HTTPS retrieval from the frozen endpoint",
      "exact timestamp, version, period, status, chain and URI structure",
      "certificateId equals SHA-512 of the returned DER certificate",
      "RSA PKCS#1 v1.5 SHA-512 signature over the NIST IR 8213 pulse serialization",
      "outputValue equals SHA-512 of the serialized signed fields plus signature"
    ],
    "version": "2.0"
  },
  "claimBoundary": {
    "evidenceClass": "post-freeze-beacon-selected-heldout-window",
    "excludes": [
      "proof that no person privately evaluated any public WikiText-2 window",
      "models or revisions other than the pinned Qwen target",
      "datasets, tokenizers, or windows outside this registration",
      "free-running or sampled generation",
      "latency, energy, and production-serving claims",
      "cross-device exact-logit reproducibility",
      "generalization to LLMs or corpora in general"
    ],
    "statement": "A one-shot, future-beacon-selected, previously unreported 32-block WikiText-2 test window evaluates the already frozen VoidToken v5 configuration. A completed result establishes only whether the frozen gates pass on that selected window and is limited evidence of transfer within the registered eligible-window pool, not corpus-wide generalization."
  },
  "configuration": {
    "backend": "voidtoken-v5",
    "bitsByLayer": [9, 8, 8, 8, 8, 8, 8, 8, 9, 8, 8, 8, 8, 8, 8, 8, 8, 8, 8, 8, 8, 8, 8, 8],
    "codeCompression": "zlib-9",
    "groupSize": 128,
    "scaleCompression": "zlib-9",
    "schedule": "group-kl-top-2-9bit-rest-8bit",
    "signMode": "none",
    "transformBlockSize": 128
  },
  "configurationSHA256": "4c7be8c836aa725722b51f66dce78af7a5094e887432e622b5322f7ca2cf0af8",
  "corpus": {
    "blockTokens": 512,
    "configuration": "wikitext-2-raw-v1",
    "file": "wikitext-2-raw-v1/test-00000-of-00001.parquet",
    "fileBytes": 732610,
    "fileSHA256": "5f1bea067869d04849c0f975a2b29c4ff47d867f484f5010ea5e861eab246d91",
    "joinSeparator": "\n\n",
    "normalization": "none",
    "repository": "Salesforce/wikitext",
    "revision": "b08601e04326c79dfdd32d625aee71d232d685c3",
    "rowOrder": "stored-order",
    "split": "test",
    "tokenization": {
      "addSpecialTokens": false,
      "allTokenIdsSHA256": "b44603066a92719a20e2dc18d6c5f7f5342b1877c20c1e2bdd92deca662d3d56",
      "fullBlocks": 584,
      "remainderTokens": 70,
      "tokenCount": 299078,
      "tokenizerRevision": "060db6499f32faf8b98477b0a26969ef7d8b9987"
    }
  },
  "evaluation": {
    "attentionImplementation": "eager",
    "blockTokens": 512,
    "cacheCanonicalization": "FP32-to-BF16-to-FP32",
    "candidateConfigurationId": "4c7be8c836aa7257",
    "candidateConfigurationSHA256": "4c7be8c836aa725722b51f66dce78af7a5094e887432e622b5322f7ca2cf0af8",
    "candidateDevelopmentGridIndex": 32,
    "compressionByteAccounting": "complete-container-bytes",
    "layers": 24,
    "predictionMode": "teacher-forced",
    "predictionsPerBlock": 128,
    "prefillTokens": 383,
    "trajectoryShapePerLayer": [383, 256],
    "windowBlocks": 32
  },
  "execution": {
    "deadline": "2026-08-04T18:00:00.000Z",
    "device": "mps",
    "localPythonBytecode": "forbidden",
    "modelDtype": "float32",
    "outcomePath": "real-llm-beacon-results/outcome.json",
    "primaryEvidenceDirectory": "real-llm-beacon-results/primary-evidence",
    "pythonBytecodeWrites": false,
    "pythonIsolatedMode": true,
    "resolutionPath": "real-llm-beacon-results/resolution.json",
    "seed": 20260729,
    "torchDeterministicAlgorithms": "warn-only"
  },
  "gates": {
    "maximumBlockwiseDeltaNLLUpperOneSided95": 0.01,
    "maximumDeltaNLLNatPerToken": 0.01,
    "minimumBlockwiseTop1LowerOneSided95": 0.99,
    "minimumCompressionRatioVsBF16": 2.0,
    "minimumTop1Agreement": 0.99,
    "minimumWilsonLowerOneSided95": 0.99,
    "requireStructuralReplay": true,
    "studentTCriticalOneSided95Df31": 1.6955187825458675,
    "wilsonZOneSided95": 1.6448536269514715
  },
  "model": {
    "architecture": "Qwen2ForCausalLM",
    "repository": "Qwen/Qwen2.5-0.5B",
    "revision": "060db6499f32faf8b98477b0a26969ef7d8b9987",
    "trustRemoteCode": false,
    "weightsBytes": 988097824,
    "weightsSHA256": "88c142557820ccad55bb59756bfcfcf891de9cc6202816bd346445188a0ed342"
  },
  "outcomePolicy": {
    "executionDeadlineMiss": "PROTOCOL_FAILURE",
    "missingOutcomeAfterAttempt": "CONSUMED_INCOMPLETE",
    "scientificFailExitCode": 2,
    "terminalVerdicts": ["PASS", "FAIL_GATES", "FAIL_EXECUTION"],
    "unexpectedErrorExitCode": 1
  },
  "protocolSourceFiles": [
    "BenchmarkCore/corelm_benchmark.py",
    "RealLLM/BEACON_HELDOUT_PROTOCOL.md",
    "RealLLM/beacon_evaluation.py",
    "RealLLM/beacon_protocol.py",
    "RealLLM/beacon_registration.json",
    "RealLLM/beacon_window_ledger.json",
    "RealLLM/benchmark_real_llm.py",
    "RealLLM/codecs.py",
    "RealLLM/prepare_beacon_assets.py",
    "RealLLM/prepare_beacon_freeze.py",
    "RealLLM/requirements.lock",
    "RealLLM/requirements.txt",
    "RealLLM/run_beacon_one_shot.py",
    "RealLLM/run_beacon_regression.py",
    "RealLLM/verify_beacon_evidence.py",
    "RealLLM/voidtoken_v5.py",
    "Tests/fixtures/nist-beacon-certificate-528943a5.pem",
    "Tests/fixtures/nist-beacon-chain-2-pulse-1884240.json",
    "Tests/test_beacon_protocol.py",
    "schemas/beacon-attempt.schema.json",
    "schemas/beacon-freeze.schema.json",
    "schemas/beacon-outcome.schema.json",
    "schemas/beacon-registration.schema.json",
    "schemas/beacon-resolution.schema.json",
    "schemas/beacon-window-ledger.schema.json",
    "security/verify_primary_evidence.py"
  ],
  "publicFreeze": {
    "freezeManifest": "RealLLM/beacon_freeze.json",
    "immutableReleaseRequired": true,
    "publicRepository": "https://github.com/ALLPROTO/core-lm-benchmark",
    "releaseApi": "https://api.github.com/repos/ALLPROTO/core-lm-benchmark/releases/tags/corelm-beacon-heldout-v1",
    "releasePublishedBeforeBeacon": true,
    "releaseUrl": "https://github.com/ALLPROTO/core-lm-benchmark/releases/tag/corelm-beacon-heldout-v1",
    "requiredTag": "corelm-beacon-heldout-v1",
    "tagRefApi": "https://api.github.com/repos/ALLPROTO/core-lm-benchmark/git/ref/tags/corelm-beacon-heldout-v1"
  },
  "regressionPolicy": {
    "allowedAfterTerminalScientificOutcome": true,
    "countsTowardScientificVerdict": false,
    "evidenceClass": "regression-only",
    "outputDirectory": "real-llm-beacon-results/regressions",
    "sameResolvedWindowRequired": true
  },
  "runtime": {
    "hfHomePolicy": {
      "absolutePathRequired": true,
      "ownerOnlyRequired": true,
      "pathFrozen": false,
      "privateCacheRequired": true
    },
    "processEnvironment": {
      "HF_HUB_DISABLE_IMPLICIT_TOKEN": "1",
      "HF_HUB_DISABLE_PROGRESS_BARS": "1",
      "HF_HUB_DISABLE_TELEMETRY": "1",
      "HF_HUB_OFFLINE": "1",
      "MKL_NUM_THREADS": "2",
      "NUMEXPR_NUM_THREADS": "2",
      "OMP_NUM_THREADS": "2",
      "OPENBLAS_NUM_THREADS": "2",
      "PYTORCH_ENABLE_MPS_FALLBACK": "0",
      "PYTORCH_MPS_FAST_MATH": "0",
      "PYTORCH_MPS_HIGH_WATERMARK_RATIO": "0.85",
      "PYTORCH_MPS_LOW_WATERMARK_RATIO": "0.75",
      "PYTORCH_MPS_PREFER_METAL": "0",
      "TOKENIZERS_PARALLELISM": "false",
      "TRANSFORMERS_OFFLINE": "1",
      "VECLIB_MAXIMUM_THREADS": "2"
    },
    "resourcePolicy": {
      "concurrentProofRunsForbidden": true,
      "emptyMPSCacheAfterEachBlock": true,
      "evaluateBlocksSequentially": true,
      "minimumFreeMemoryPercent": 15,
      "minimumPhysicalMemoryGiB": 8
    },
    "versions": {
      "huggingfaceHub": "1.25.1",
      "numpy": "2.5.1",
      "pyarrow": "23.0.1",
      "python": "3.12.13",
      "safetensors": "0.8.0",
      "tokenizers": "0.22.2",
      "torch": "2.13.0",
      "transformers": "5.14.1",
      "zlibCompileVersion": "1.2.12",
      "zlibRuntimeVersion": "1.2.12"
    }
  },
  "schemaVersion": "corelm-beacon-registration-v1",
  "selection": {
    "candidateCount": 15,
    "domainSeparatorHex": "436f72654c4d2f626561636f6e2d68656c646f75742f763100",
    "mapping": "For counter=0,1,... compute SHA-512(domain || uint64be(len(registrationBytes)) || registrationBytes || outputValueBytes || uint64be(counter)); interpret big-endian; accept when x < 2^512-(2^512 mod N); select candidate x mod N.",
    "registrationBytes": "exact committed bytes of RealLLM/beacon_registration.json",
    "windowBlocks": 32,
    "windowLedgerPath": "RealLLM/beacon_window_ledger.json",
    "windowLedgerSHA256": "81e84d09682bb4beab5f42c8bd87179a874b879eaf6e6ca539723e54bbc75a83"
  },
  "status": "preregistered-awaiting-public-freeze-and-future-beacon",
  "suiteId": "qwen2.5-0.5b-kv-voidtoken-v5-beacon-heldout-v1"
}
